{
  "id": "plausibility_v4_logreg",
  "name": "Plausibility V4 Logreg",
  "version": "v4.0.0",
  "created_at": "2025-09-17T03:02:04Z",
  "git_commit": "0000000",
  "description": "Auto-generated manifest draft",
  "tags": [
    "plausibility",
    "auto"
  ],
  "parameters": {
    "model_type": "logreg"
  },
  "metrics": {
    "primary": 0.0,
    "secondary": {},
    "calibration": {}
  },
  "artifacts": [
    {
      "path": "models/plausibility_v4_logreg.pkl",
      "type": "model",
      "hash_sha256": "c393616656c14587ac2927b955a9bffec6c4d2ea8ec165f4b5d802504fdc00c0",
      "size_bytes": 1863,
      "format": "pickle"
    }
  ],
  "dataset": {
    "name": "unknown",
    "version": "na",
    "hash": "93316efe530659c04bc46a19a9d39b15916e804b8c144b4a411b469b04ef73cc"
  },
  "lineage": {
    "parents": [],
    "provenance_graph_hash": "c72671ebf27e411821a55a75df7f5075cd862ad8babb4df6aa12090af76ae0c3"
  },
  "hashes": {
    "manifest_sha256": "3f38d90f13ac872626c3df1752e75ed1e243e17bc724a2351bb7dc63d4c960fd"
  },
  "signatures": [
    {
      "alg": "ed25519",
      "sig": "6nMPewdfu6oiajdlTcSZHVQEEvtfMiTvhZsGMHUtBEkvfZW0x8AZuwMt74kVWtyn+xmGcQTjYk+lDU8NuC2lDQ==",
      "public_key_fingerprint": "25c7a15472815b86addb077aa5797afa6785c4d096adfcbc43fb8d9fcd06d007",
      "ts": "2025-09-17T04:18:00.369383Z"
    }
  ]
}